{
  "displayName": "DeepSeek",
  "features": {
    "bidi": true,
    "direction": true,
    "shadowOpen": true,
    "typography": true
  },
  "match": {
    "hosts": ["chat.deepseek.com"],
    "pathPrefixes": ["/"]
  },
  "metadata": {
    "product": "DeepSeek",
    "source": "official",
    "verification": "synthetic-fixture"
  },
  "profileId": "official:deepseek",
  "profileKind": "bundled",
  "profileVersion": 3,
  "rules": [
    {
      "alignmentMode": "preserve",
      "category": "code",
      "directionMode": "force-ltr",
      "enabled": true,
      "initialDelayMs": 0,
      "ruleId": "rule-ccfde4b9",
      "selector": "code",
      "typographyMode": "preserve"
    },
    {
      "alignmentMode": "preserve",
      "category": "code",
      "directionMode": "force-ltr",
      "enabled": true,
      "initialDelayMs": 0,
      "ruleId": "rule-2a3aa7e5",
      "selector": "pre",
      "typographyMode": "preserve"
    },
    {
      "alignmentMode": "preserve",
      "category": "editor",
      "directionMode": "preserve",
      "enabled": true,
      "initialDelayMs": 0,
      "ruleId": "rule-6a813b4c",
      "selector": "[contenteditable=\"true\"]",
      "typographyMode": "preserve"
    },
    {
      "alignmentMode": "preserve",
      "category": "editor",
      "directionMode": "preserve",
      "enabled": true,
      "initialDelayMs": 0,
      "ruleId": "rule-57144a3f",
      "selector": "[role=\"textbox\"]",
      "typographyMode": "preserve"
    },
    {
      "alignmentMode": "preserve",
      "category": "math",
      "directionMode": "preserve",
      "enabled": true,
      "initialDelayMs": 0,
      "ruleId": "rule-b2e1a8d2",
      "selector": ".MathJax",
      "typographyMode": "preserve"
    },
    {
      "alignmentMode": "preserve",
      "category": "math",
      "directionMode": "preserve",
      "enabled": true,
      "initialDelayMs": 0,
      "ruleId": "rule-26e0eb5e",
      "selector": ".katex",
      "typographyMode": "preserve"
    },
    {
      "alignmentMode": "preserve",
      "category": "math",
      "directionMode": "preserve",
      "enabled": true,
      "initialDelayMs": 0,
      "ruleId": "rule-9bd5b027",
      "selector": "math",
      "typographyMode": "preserve"
    },
    {
      "alignmentMode": "preserve",
      "category": "terminal",
      "directionMode": "force-ltr",
      "enabled": true,
      "initialDelayMs": 0,
      "ruleId": "rule-20bf9dbf",
      "selector": ".xterm",
      "typographyMode": "preserve"
    },
    {
      "alignmentMode": "preserve",
      "category": "terminal",
      "directionMode": "force-ltr",
      "enabled": true,
      "initialDelayMs": 0,
      "ruleId": "rule-68da0672",
      "selector": "[data-terminal]",
      "typographyMode": "preserve"
    }
  ],
  "schemaVersion": "3.0.0",
  "scopePolicy": {
    "mode": "conversation",
    "pathDepth": 2
  },
  "selectors": {
    "code": ["code", "pre"],
    "content": [],
    "editor": ["[contenteditable=\"true\"]", "[role=\"textbox\"]"],
    "exclude": [],
    "math": [".MathJax", ".katex", "math"],
    "mutationSensitive": [],
    "terminal": [".xterm", "[data-terminal]"]
  },
  "thresholds": {}
}
